{
  "schema_version": 1,
  "context_id": "facts:request384",
  "referents": [
    {
      "id": "A",
      "type": {
        "kind": "Entity"
      }
    },
    {
      "id": "B",
      "type": {
        "kind": "Entity"
      }
    },
    {
      "id": "E1",
      "type": {
        "kind": "Event"
      }
    },
    {
      "id": "E2",
      "type": {
        "kind": "Event"
      }
    },
    {
      "id": "Q1",
      "type": {
        "kind": "Nominal",
        "sort_id": "q"
      }
    },
    {
      "id": "Q2",
      "type": {
        "kind": "Nominal",
        "sort_id": "q"
      }
    }
  ],
  "facts": [
    {
      "id": "timed-pos",
      "atom": {
        "symbol": "r",
        "args": [
          {
            "role": "left",
            "value": {
              "kind": "Ref",
              "id": "A"
            }
          },
          {
            "role": "right",
            "value": {
              "kind": "Ref",
              "id": "B"
            }
          }
        ]
      },
      "polarity": "positive",
      "assertion_scope": "asserted",
      "source": {
        "kind": "document",
        "id": "source-timed-pos",
        "reference": {
          "id": "neutral-facts-384",
          "uri": "https://github.com/clickbytes/golingua/issues/384",
          "version": "2026-10-26",
          "license": "internal-neutral-example"
        }
      },
      "valid_time": {
        "from": "2026-10-26T01:00:00Z",
        "to": "2026-10-26T02:00:00Z"
      }
    },
    {
      "id": "timed-neg",
      "atom": {
        "symbol": "r",
        "args": [
          {
            "role": "left",
            "value": {
              "kind": "Ref",
              "id": "A"
            }
          },
          {
            "role": "right",
            "value": {
              "kind": "Ref",
              "id": "B"
            }
          }
        ]
      },
      "polarity": "negative",
      "assertion_scope": "asserted",
      "source": {
        "kind": "document",
        "id": "source-timed-neg",
        "reference": {
          "id": "neutral-facts-384",
          "uri": "https://github.com/clickbytes/golingua/issues/384",
          "version": "2026-10-26",
          "license": "internal-neutral-example"
        }
      },
      "valid_time": {
        "from": "2026-10-26T01:00:00Z",
        "to": "2026-10-26T02:00:00Z"
      }
    }
  ],
  "at": "2026-10-26T02:00:01Z"
}
