{"schema_version": 1, "context_id": "facts:request384", "referents": [{"id": "A", "type": {"kind": "Entity"}}, {"id": "B", "type": {"kind": "Entity"}}, {"id": "E1", "type": {"kind": "Event"}}, {"id": "E2", "type": {"kind": "Event"}}, {"id": "Q1", "type": {"kind": "Nominal", "sort_id": "q"}}, {"id": "Q2", "type": {"kind": "Nominal", "sort_id": "q"}}], "facts": [{"id": "r-pos", "atom": {"symbol": "r", "args": [{"role": "right", "value": {"kind": "Ref", "id": "B"}}, {"role": "left", "value": {"kind": "Ref", "id": "A"}}]}, "polarity": "positive", "assertion_scope": "asserted", "source": {"kind": "document", "id": "source-r-pos", "reference": {"id": "neutral-facts-384", "uri": "", "version": "2026-10-26", "license": "internal-neutral-example"}}}, {"id": "r-neg", "atom": {"symbol": "r", "args": [{"role": "left", "value": {"kind": "Ref", "id": "A"}}, {"role": "right", "value": {"kind": "Ref", "id": "B"}}]}, "polarity": "negative", "assertion_scope": "asserted", "source": {"kind": "document", "id": "source-r-neg", "reference": {"id": "neutral-facts-384", "uri": "https://github.com/clickbytes/golingua/issues/384", "version": "2026-10-26", "license": "internal-neutral-example"}}}]}
